{
    "companyRegistrationNumber": "401694989",
    "mainAddress": {
        "street": "265 rue Denis Papin",
        "city": "Villefontaine",
        "postalCode": "38090",
        "countryCode": "FR"
    },
    "entreprisePhone": {
        "value": "04 74 96 27 34",
        "isMobile": false,
        "qualification": "professional"
    },
    "entrepriseEmail": {
        "value": "contact@blitzbs.com",
        "qualification": "professional"
    },
    "repository": "https://annuaire-entreprises.data.gouv.fr/entreprise/blitz-business-services-par-abreviation-blitz-bs-401694989"
}